{
  "inputBasename": "ExplicitWaitJupiterTest.java",
  "sourceFramework": "selenium-java",
  "subtractive": false,
  "scenarios": [
    {
      "id": "1.1",
      "title": "[EWT-1] - Check that the landscape image loads with the correct src",
      "userAction": "Navigate to the loading-images demo page and wait for the lazy-loaded landscape image to appear in the DOM, then verify its src attribute contains 'landscape'.",
      "expectedAssertions": [
        "landscape image (#landscape) is attached to the DOM within 10 000 ms of page load",
        "landscape image src attribute matches /landscape/i after lazy-load completes"
      ]
    }
  ],
  "requiredPOMs": [
    "outputs/helper/page-object/pages/loading-images.page.ts"
  ],
  "requiredFixtures": [
    "outputs/helper/fixtures/base.fixture.ts"
  ],
  "requiredPages": [
    "outputs/helper/page-object/pages/loading-images.page.ts"
  ],
  "requiredBlocks": [],
  "requiredApi": [],
  "requiredActions": [],
  "requiredUtilities": [],
  "requiredTestData": [
    "outputs/helper/test-data/labels.ts"
  ],
  "requiredTypes": [],
  "locatorTable": [
    {
      "original": "By.id(\"landscape\")",
      "target": "page.locator('#landscape')",
      "confidence": "high",
      "notes": "Mechanical By.id → CSS id mapping per KB hallucination rule. No DOM evidence for alt attribute; if reviewer confirms alt='Landscape' on the img element, upgrade to page.getByAltText(/landscape/i) for higher selector quality."
    }
  ],
  "hallucinationDefensePins": [],
  "expectedMetrics": {
    "selectorQualityScore": 0.0,
    "smellCountDelta": -6,
    "locDelta": -1,
    "antiPatternCoverage": "6/6"
  }
}
