{
  "inputBasename": "FluentWaitJupiterTest.java",
  "sourceFramework": "selenium-java",
  "subtractive": false,
  "scenarios": [
    {
      "id": "1.1",
      "title": "[FWJ-1] - Check that the landscape image loads with a valid src",
      "userAction": "Navigate to the loading-images demo page and wait for the #landscape image element to become visible, then verify its src attribute contains 'landscape' (case-insensitive).",
      "expectedAssertions": [
        "After page navigation, the #landscape image element is visible in the DOM (waitForPageLoad passes)",
        "The #landscape image src attribute value contains the substring 'landscape' (case-insensitive, toHaveAttribute with /landscape/i)"
      ]
    }
  ],
  "requiredPOMs": [],
  "requiredFixtures": [
    "outputs/helper/fixtures/base.fixture.ts"
  ],
  "requiredPages": [
    "outputs/helper/page-object/pages/loading-images.page.ts"
  ],
  "requiredBlocks": [],
  "requiredApi": [],
  "requiredActions": [],
  "requiredUtilities": [],
  "requiredTestData": [
    "outputs/helper/test-data/labels.ts"
  ],
  "requiredTypes": [],
  "locatorTable": [
    {
      "original": "By.id(\"landscape\")",
      "target": "page.locator('#landscape')",
      "confidence": "high",
      "notes": "Mechanical By.id -> CSS-id translation per mandatory hallucination-defense rule (analyze.md rule 1). No DOM snapshot; no alt-text or aria evidence available. Reviewer upgrade path (Q1): if confirmed alt attribute exists (e.g. alt='landscape'), Stage 2 should use page.getByAltText(/landscape/i) instead — raises selector quality from 0/1 to 1/1."
    }
  ],
  "hallucinationDefensePins": [],
  "expectedMetrics": {
    "selectorQualityScore": 0.0,
    "smellCountDelta": -7,
    "locDelta": -18,
    "antiPatternCoverage": "7/7"
  }
}
